{
  "$ref": "#/definitions/site_config",
  "definitions": {
    "site_config": {
      "type": "object",
      "properties": {
        "title": {
          "type": "string"
        },
        "subtitle": {
          "type": "string"
        },
        "keywords": {
          "type": "string"
        },
        "description": {
          "type": "string"
        },
        "logo": {
          "type": "string"
        },
        "siteName": {
          "type": "string"
        },
        "navigation": {
          "type": "array",
          "items": {
            "type": "object",
            "properties": {
              "name": {
                "type": "string"
              },
              "url": {
                "type": "string"
              }
            },
            "required": [
              "name",
              "url"
            ],
            "additionalProperties": false
          }
        },
        "friendLinks": {
          "type": "array",
          "items": {
            "type": "object",
            "properties": {
              "name": {
                "type": "string"
              },
              "url": {
                "type": "string"
              },
              "description": {
                "type": "string"
              }
            },
            "required": [
              "name",
              "url",
              "description"
            ],
            "additionalProperties": false
          }
        },
        "copyright": {
          "type": "string"
        },
        "$schema": {
          "type": "string"
        }
      },
      "required": [
        "title",
        "subtitle",
        "keywords",
        "description",
        "siteName",
        "navigation",
        "friendLinks",
        "copyright"
      ],
      "additionalProperties": false
    }
  },
  "$schema": "http://json-schema.org/draft-07/schema#"
}